{
  "schema_version": 1,
  "install_id": "5b0e8f2c9a4d4e71b3c6a1f07d2e9b48",
  "scanner_version": "0.1.0",
  "exported_at_unix_ms": 1790000600000,
  "findings": [
    {
      "schema_version": 1,
      "finding_id": "finding.3f2a9c",
      "scan_id": "scan.2026-09-22.1",
      "rule_id": "process.ssh.running",
      "rule_version": 1,
      "observed_at_unix_ms": 1790000000000,
      "severity": "medium",
      "confidence": 100,
      "message": "An SSH server process was observed",
      "evidence": [
        "process.names"
      ]
    }
  ]
}
